{
  "schema_version": "0.1",
  "feed_version": "2026-06-04",
  "generated_at": "2026-06-05T12:38:50+09:00",
  "item_count": 326,
  "group_count": 7,
  "policy": {
    "scope": "metadata_only_high_confidence",
    "raw_items_preserved": true,
    "full_body_fetched_for_dedupe": false,
    "false_positive_policy": "avoid_suppressing_distinct_notices"
  },
  "groups": [
    {
      "id": "same_notice:270a4bd5c729bb7f",
      "relationship": "same_notice",
      "confidence": "high",
      "consumer_action": "dedupe_notifications",
      "canonical_item_id": "pnu-onestop-notices:2037",
      "item_ids": [
        "pnu-onestop-notices:2037",
        "pnu-onestop-scholarship:672"
      ],
      "source_ids": [
        "pnu-onestop-notices",
        "pnu-onestop-scholarship"
      ],
      "published_dates": [
        "2026-04-13"
      ],
      "representative_title": "2026년 대통령과학장학금 학생 신청 안내(학부)",
      "evidence": [
        "cross_source",
        "same_normalized_title",
        "same_published_date",
        "shared_attachment_names"
      ]
    },
    {
      "id": "same_notice:062d3883b7af12fc",
      "relationship": "same_notice",
      "confidence": "high",
      "consumer_action": "dedupe_notifications",
      "canonical_item_id": "pnu-main-notice:1508999",
      "item_ids": [
        "pnu-main-notice:1508999",
        "pnu-onestop-scholarship:678"
      ],
      "source_ids": [
        "pnu-main-notice",
        "pnu-onestop-scholarship"
      ],
      "published_dates": [
        "2026-05-20"
      ],
      "representative_title": "2026년 2학기 국가장학금 1차 신청 기간 안내",
      "evidence": [
        "cross_source",
        "same_normalized_title",
        "same_published_date",
        "shared_attachment_names"
      ]
    },
    {
      "id": "same_notice:87dadcf6901a2ac0",
      "relationship": "same_notice",
      "confidence": "high",
      "consumer_action": "dedupe_notifications",
      "canonical_item_id": "pnu-main-notice:1509022",
      "item_ids": [
        "pnu-main-notice:1509022",
        "pnu-onestop-notices:2072"
      ],
      "source_ids": [
        "pnu-main-notice",
        "pnu-onestop-notices"
      ],
      "published_dates": [
        "2026-05-21"
      ],
      "representative_title": "[AX·정보화혁신본부] 「AI 창작 챌린지 공모전」 개최 안내",
      "evidence": [
        "cross_source",
        "same_normalized_title",
        "same_published_date",
        "shared_attachment_names"
      ]
    },
    {
      "id": "same_notice:b6a9e9d98e10df58",
      "relationship": "same_notice",
      "confidence": "high",
      "consumer_action": "dedupe_notifications",
      "canonical_item_id": "pnu-main-notice:1509229",
      "item_ids": [
        "pnu-main-notice:1509229",
        "pnu-onestop-notices:2077"
      ],
      "source_ids": [
        "pnu-main-notice",
        "pnu-onestop-notices"
      ],
      "published_dates": [
        "2026-06-02"
      ],
      "representative_title": "2026학년도 여름계절 및 도약수업 2차(최종) 폐강강좌 통보 및 수강정정 안내",
      "evidence": [
        "cross_source",
        "same_normalized_title",
        "same_published_date",
        "shared_attachment_names"
      ]
    },
    {
      "id": "same_notice:4168c261c6b27c33",
      "relationship": "same_notice",
      "confidence": "high",
      "consumer_action": "dedupe_notifications",
      "canonical_item_id": "pnu-main-notice:1509210",
      "item_ids": [
        "pnu-main-notice:1509210",
        "pnu-onestop-notices:2076"
      ],
      "source_ids": [
        "pnu-main-notice",
        "pnu-onestop-notices"
      ],
      "published_dates": [
        "2026-06-02"
      ],
      "representative_title": "학생 마음건강 전수조사 참여 요청",
      "evidence": [
        "cross_source",
        "same_normalized_title",
        "same_published_date",
        "shared_attachment_names"
      ]
    },
    {
      "id": "same_notice:ae5d120cda0a2bf0",
      "relationship": "same_notice",
      "confidence": "high",
      "consumer_action": "dedupe_notifications",
      "canonical_item_id": "pnu-main-notice:1509245",
      "item_ids": [
        "pnu-main-notice:1509245",
        "pnu-onestop-scholarship:681"
      ],
      "source_ids": [
        "pnu-main-notice",
        "pnu-onestop-scholarship"
      ],
      "published_dates": [
        "2026-06-04"
      ],
      "representative_title": "2026학년도 1학기 경제사정곤란 대학생 장학금 신청 및 국가장학금Ⅱ유형 지급 기준 안내",
      "evidence": [
        "cross_source",
        "same_normalized_title",
        "same_published_date",
        "shared_attachment_names"
      ]
    },
    {
      "id": "same_notice:2254e25379b7b34c",
      "relationship": "same_notice",
      "confidence": "high",
      "consumer_action": "dedupe_notifications",
      "canonical_item_id": "pnu-main-notice:1509284",
      "item_ids": [
        "pnu-main-notice:1509284",
        "pnu-onestop-notices:2079"
      ],
      "source_ids": [
        "pnu-main-notice",
        "pnu-onestop-notices"
      ],
      "published_dates": [
        "2026-06-04"
      ],
      "representative_title": "[장학]한국농어촌희망재단 2026학년도 2학기 청년창업농장학금 선발 안내",
      "evidence": [
        "cross_source",
        "same_normalized_title",
        "same_published_date",
        "shared_attachment_names"
      ]
    }
  ]
}
